{
  "anchor_id": "1CO.9:13",
  "canon_uri": "canon/NT/1CO.md#1CO.9:13",
  "text_tradition": "LXX",
  "generated_at": "2026-03-16T02:01:16+00:00",
  "generator_version": "phase3-backlinks-v1",
  "schema_version": "v2",
  "verse_text": "Nevertheless we have not used this right, but endure all things lest we hinder the gospel of Christ. Do you not know that those who minister the holy things eat of the things of the temple, and those who serve at the altar partake of the offerings of the altar?",
  "pericope": {
    "id": "1CO.P020",
    "title": "A Good Example: Paul's Rights",
    "range": "1CO.8:13-9:13",
    "liturgical_use": []
  },
  "topic_threads": [],
  "depth_available": 3,
  "links": [
    {
      "source_file": "study/footnotes/NT/2CO_footnotes.md",
      "line_number": 453,
      "raw_match": "[[1CO.9:4]]-18",
      "reference_type": "wikilink_range",
      "context": "Pure doctrine is taught out of pure motives. A mark of apostolic authenticity is the refusal of excessive money. The clergy draw their living from the Church, but not to the point of getting rich (see [[1CO.9:4]]-18; [[1TI.6:3]]-10; [[TIT.1:11]]). Paul's opponents dared not make this claim."
    },
    {
      "source_file": "study/footnotes/NT/ACT_footnotes.md",
      "line_number": 1292,
      "raw_match": "[[1CO.9:1]]-23",
      "reference_type": "wikilink_range",
      "context": "While St. Paul teaches the clergy should be supported materially by the faithful ([[1CO.9:1]]-23), he has not required this for himself from the communities he established. This allowed Paul to preach all the more freely and took away any opportunity for others to question his motives (compare with [[NEH.5:14]]-19; 13:10-13). The quotation from Christ (v. 35) is not recorded in the four Gospels (see [[JOH.21:25]])."
    }
  ]
}
