{
  "anchor_id": "EZK.23:14",
  "canon_uri": "canon/OT/EZK.md#EZK.23:14",
  "text_tradition": "LXX",
  "generated_at": "2026-03-16T02:01:16+00:00",
  "generator_version": "phase3-backlinks-v1",
  "schema_version": "v2",
  "verse_text": "but Oholibah added to her fornication; for she looked at men portrayed on the wall, images of Chaldeans portrayed in color,",
  "pericope": {
    "id": "EZK.P032",
    "title": "The Younger Sister, Jerusalem",
    "range": "EZK.23:10-23:20",
    "liturgical_use": []
  },
  "topic_threads": [],
  "depth_available": 3,
  "links": [
    {
      "source_file": "study/footnotes/NT/REV_footnotes.md",
      "line_number": 1515,
      "raw_match": "[[EZK.23:11]]-35",
      "reference_type": "wikilink_range",
      "context": "The peoples, multitudes, nations, and tongues represent the diversity of the Roman Empire (see v. 18). Reaping what she sows, Rome will be conquered as she has conquered. That the ten horns (vassal kings) and the beast (false prophet) will rise up against the harlot (v. 16) indicates the self-destructiveness of evil (see [[EZK.23:11]]-35). The Antichrist proves himself (in contrast to the true Christ, v. 14) the traitor of traitors. Rome will be stripped, devoured, and burned (see Lv 21:9, where death by fire is prescribed for a harlot who is the daughter of a priest)."
    }
  ]
}
