{
  "anchor_id": "HEB.7:17",
  "canon_uri": "canon/NT/HEB.md#HEB.7:17",
  "text_tradition": "LXX",
  "generated_at": "2026-03-16T02:01:16+00:00",
  "generator_version": "phase3-backlinks-v1",
  "schema_version": "v2",
  "verse_text": "For He testifies: 'You are a priest forever According to the order of Melchizedek.'",
  "pericope": {
    "id": "HEB.P015",
    "title": "Priestly Orders: Levi and Melchizedek",
    "range": "HEB.6:20-7:27",
    "liturgical_use": []
  },
  "topic_threads": [],
  "depth_available": 3,
  "links": [
    {
      "source_file": "study/articles/NT/REV_articles.md",
      "line_number": 21,
      "raw_match": "[[HEB.7:17]]",
      "reference_type": "wikilink",
      "context": "Virtually all students of the Bible realize there was liturgical worship in Israel. Immediately after the giving of the Ten Commandments ([[EXO.20:1]]-17), instructions for building the altar were set forth ([[EXO.20:24]]-26). Then comes instruction concerning keeping the Sabbath ([[EXO.23:10]]-13), the annual feasts ([[EXO.23:14]]-19), and the various offerings and furnishings in the sanctuary ([[EXO.25:1]]-40). Following this, chapters 26-30 deal with such matters as the design of the tabernacle, the altar, and the outer court, the priests' vestments and their consecration, and instructions for daily offerings. Liturgical worship is also found in heaven, which is to be expected, since God instructed Moses to make the earthly place of worship as a 'copy and shadow of the heavenly things' ([[HEB.8:5]]; see [[EXO.25:40]]). Heavenly worship is revealed in such passages as [[ISA.6:1]]-8, where we see the prophet caught up to heaven for the liturgy, and Revelation 4, which records the apostle John's vision of heaven's liturgy. The key to comprehending liturgy in the New Testament is to understand the work of the High Priest, our Lord Jesus Christ, who inaugurates the new covenant. Christ is 'a priest forever' ([[HEB.7:17]], [[HEB.7:21]]). It is unthinkable that He would be a priest but not serve liturgically: 'forever' suggests He serves continually, without ceasing, in the heavenly tabernacle. Further, He is called not only a priest but a liturgist: 'a Minister [Gr. leitourgos, lit., 'liturgist') of the sanctuary and of the true tabernacle which the Lord erected' ([[HEB.8:2]]). Christian worship on earth, to be fully Christian, must mirror the worship of Christ in heaven. Moreover, Christ is 'Mediator of a better covenant' ([[HEB.8:6]]). What is that covenant? In the words of the Lord, 'This cup is the new covenant in My blood' ([[1CO.11:25]]). Just as the blood of bulls and goats in the old covenant prefigured Christ's sacrifice to come, so the eucharistic feast brings to us the fullness of His new covenant offering, completed at the Cross and fulfilled in His Resurrection. This once-for-all offering of Himself ([[HEB.7:27]]) which He as High Priest presents at the heavenly altar is an offering in which we participate through the Divine Liturgy in the Church. This is the worship of the New Testament Church! Given this biblical background, a number of New Testament passages take on new meaning. 1 [[ACT.13:2]]: 'As they ministered to the Lord [lit., 'as they were in the liturgy of the Lord'] and fasted, the Holy Spirit said, 'Now separate to Me Barnabas and Saul.' ' We learn that (a) these two apostles were called by God during worship, and (b) the Holy Spirit speaks in a liturgical setting. 2 [[ACT.20:7]]: 'Now on the first day of the week, when the disciples came together to break bread, Paul, ready to depart the next day, spoke to them.' Communion was held each Sunday. 3 [[ROM.16:16]]: 'Greet one another with a holy kiss.' A kiss of greeting was common in this ancient culture. The 'holy kiss,' however, was an element of the Christian liturgy that signified the people of God were reconciled to one another, so that they might receive the Body and Blood of Christ in peace. 4 [[EPH.5:14]]: 'Awake, you who sleep, / Arise from the dead, / And Christ will give you light.' This is an ancient baptismal hymn, already in use by the time Ephesians was written. Other examples of creeds and hymns of New Testament times are seen in [[1TI.3:16]] and [[2TI.2:11]]-13. 5 [[HEB.13:10]]: 'We have an altar' reveals the continuation of the altar in New Testament worship."
    }
  ]
}
