{
  "anchor_id": "GEN.4:4",
  "canon_uri": "canon/OT/GEN.md#GEN.4:4",
  "text_tradition": "LXX",
  "generated_at": "2026-03-16T02:01:16+00:00",
  "generator_version": "phase3-backlinks-v1",
  "schema_version": "v2",
  "verse_text": "Abel also brought a sacrifice from the firstborn of his flock and of their fat. The Lord respected Abel and his offering,",
  "pericope": {
    "id": "GEN.P004",
    "title": "Cain Kills Abel",
    "range": "GEN.3:24-4:15",
    "liturgical_use": []
  },
  "topic_threads": [],
  "depth_available": 3,
  "links": [
    {
      "source_file": "study/footnotes/NT/1JN_footnotes.md",
      "line_number": 201,
      "raw_match": "[[GEN.4:4]]",
      "reference_type": "wikilink",
      "context": "We are to give our attention to deeds, not just to words. Abel showed himself righteous, a child of faith and love; Cain showed himself evil, self-centered and envious (see [[GEN.4:4]], [[GEN.4:8]]; [[HEB.11:4]]; 12:24)."
    },
    {
      "source_file": "study/footnotes/NT/JUD_footnotes.md",
      "line_number": 79,
      "raw_match": "[[GEN.4:3]]-24",
      "reference_type": "wikilink_range",
      "context": "A threefold woe or warning of great sorrow, using a triad of Israel's most famous offenders: (1) Cain ([[GEN.4:3]]-24) sinned by faithlessness and envy, especially over an honor given to another. His sin led to murder ([[GEN.4:16]]-24). (2) Balaam (Nm 22-24) sinned by greed, which led to lying and an all-out assault upon the truth, which he knew as well. (3) Korah ([[NUM.16:1]]-35) sinned by ambition, pride, and arrogance, grasping for leadership against God's will. His sin led to blatant rebellion against God."
    }
  ]
}
