{
  "anchor_id": "ACT.22:20",
  "canon_uri": "canon/NT/ACT.md#ACT.22:20",
  "text_tradition": "LXX",
  "generated_at": "2026-03-16T02:01:16+00:00",
  "generator_version": "phase3-backlinks-v1",
  "schema_version": "v2",
  "verse_text": "And when the blood of Your martyr Stephen was shed, I also was standing by consenting to his death, and guarding the clothes of those who were killing him.'",
  "pericope": {
    "id": "ACT.P080",
    "title": "Paul's Defense at the Temple",
    "range": "ACT.21:40-22:20",
    "liturgical_use": []
  },
  "topic_threads": [],
  "depth_available": 3,
  "links": [
    {
      "source_file": "study/footnotes/NT/EPH_footnotes.md",
      "line_number": 181,
      "raw_match": "[[ACT.22:3]]-21",
      "reference_type": "wikilink_range",
      "context": "God's revelation to Paul began on the road to Damascus ([[ACT.22:3]]-21). God was gracious to Paul not for his own sake but for others (see [[ACT.9:15]], [[ACT.9:16]])."
    }
  ]
}
