{
  "anchor_id": "MRK.14:3",
  "canon_uri": "canon/NT/MRK.md#MRK.14:3",
  "text_tradition": "LXX",
  "generated_at": "2026-03-16T02:01:16+00:00",
  "generator_version": "phase3-backlinks-v1",
  "schema_version": "v2",
  "verse_text": "And being in Bethany at the house of Simon the leper, as He sat at the table, a woman came having an alabaster flask of very costly oil of spikenard. Then she broke the flask and poured it on His head.",
  "pericope": {
    "id": "MRK.P049",
    "title": "The Anointing at Bethany",
    "range": "MRK.14:2-14:8",
    "liturgical_use": []
  },
  "topic_threads": [],
  "depth_available": 3,
  "links": [
    {
      "source_file": "study/footnotes/NT/MAT_footnotes.md",
      "line_number": 2301,
      "raw_match": "[[MRK.14:3]]-9",
      "reference_type": "wikilink_range",
      "context": "Because of her fervent faith, Jesus promises perpetual public memory of this woman. There is no consensus among the Fathers as to her identity in relation to accounts of similar events in [[MRK.14:3]]-9; [[LUK.7:36]]-38; and [[JOH.12:1]]-8. Some Fathers say that there were three different women in these four accounts, others that there were only two."
    },
    {
      "source_file": "study/footnotes/OT/SNG_footnotes.md",
      "line_number": 95,
      "raw_match": "[[MRK.14:3]]",
      "reference_type": "wikilink",
      "context": "This prophetic verse was fulfilled by Mary of Bethany's anointing of the Lord with spikenard for His burial while He was at the table ([[MAT.26:6]], [[MAT.26:7]]; [[MRK.14:3]]; [[LUK.7:37]], [[LUK.7:38]]; Jn 12:3)."
    }
  ]
}
