{
  "anchor_id": "1CO.15:25",
  "canon_uri": "canon/NT/1CO.md#1CO.15:25",
  "text_tradition": "LXX",
  "generated_at": "2026-03-16T02:01:16+00:00",
  "generator_version": "phase3-backlinks-v1",
  "schema_version": "v2",
  "verse_text": "For He must reign till He has put all enemies under His feet.",
  "pericope": {
    "id": "1CO.P035",
    "title": "The Resurrection and the Kingdom",
    "range": "1CO.15:19-15:33",
    "liturgical_use": []
  },
  "topic_threads": [],
  "depth_available": 3,
  "links": [
    {
      "source_file": "study/footnotes/NT/LUK_footnotes.md",
      "line_number": 2035,
      "raw_match": "[[1CO.15:20]]-28",
      "reference_type": "wikilink_range",
      "context": "Jesus does not have His life taken from Him, but will voluntarily commit it to the Father. His was the first human soul not to be taken to Hades; instead it was freely given into the hands of God. Thus, Christ frees all of humanity from death's grip. His death reconciles mankind to God, not by satisfying the Father's need for blood-justice as some might teach, but by causing every aspect of our corrupt human nature to be transformed, for whatever divinity touches is healed. Christ accepts human nature in order to sanctify human nature; He accepts our weakness in order to make us strong; He takes on our sin in order to free us from sin; He suffers in order to transfigure suffering; and He enters death in order to destroy it ([[1CO.15:20]]-28; see note at [[MAT.27:50]])."
    },
    {
      "source_file": "study/footnotes/NT/MAT_footnotes.md",
      "line_number": 2472,
      "raw_match": "[[1CO.15:20]]-28",
      "reference_type": "wikilink_range",
      "context": "Yielded up His spirit: Christ's death was voluntary to the very end, for even on the Cross, His life could not be taken from Him against His will. Christ accepts death on the Cross neither to receive the Father's punishment on our behalf, nor to satisfy the Father's need for blood-justice (as if God would demand such things), but so that by entering death as the divine Son of God, He can destroy this last enemy, which is death itself ([[1CO.15:20]]-28; see note at [[LUK.23:46]])."
    },
    {
      "source_file": "study/footnotes/NT/MAT_footnotes.md",
      "line_number": 2553,
      "raw_match": "[[1CO.15:20]]-28",
      "reference_type": "wikilink_range",
      "context": "All authority has been given to Me: Christ declares that the authority that was His by nature in His divinity is now also possessed by His glorified human nature. This human nature has now trampled the final enemy--death ([[1CO.15:20]]-28)."
    }
  ]
}
