{
  "anchor_id": "NUM.16:19",
  "canon_uri": "canon/OT/NUM.md#NUM.16:19",
  "text_tradition": "LXX",
  "generated_at": "2026-03-16T02:01:16+00:00",
  "generator_version": "phase3-backlinks-v1",
  "schema_version": "v2",
  "verse_text": "Thus Korah gathered all his company against them at the door of the tabernacle of testimony. Then the glory of the Lord appeared to all the congregation.",
  "pericope": {
    "id": "NUM.P037",
    "title": "Rebellion against Moses and Aaron",
    "range": "NUM.15:41-16:34",
    "liturgical_use": []
  },
  "topic_threads": [],
  "depth_available": 3,
  "links": [
    {
      "source_file": "study/footnotes/NT/JUD_footnotes.md",
      "line_number": 82,
      "raw_match": "[[NUM.16:1]]-35",
      "reference_type": "wikilink_range",
      "context": "A threefold woe or warning of great sorrow, using a triad of Israel's most famous offenders: (1) Cain ([[GEN.4:3]]-24) sinned by faithlessness and envy, especially over an honor given to another. His sin led to murder ([[GEN.4:16]]-24). (2) Balaam (Nm 22-24) sinned by greed, which led to lying and an all-out assault upon the truth, which he knew as well. (3) Korah ([[NUM.16:1]]-35) sinned by ambition, pride, and arrogance, grasping for leadership against God's will. His sin led to blatant rebellion against God."
    }
  ]
}
