{
  "anchor_id": "MAT.8:25",
  "canon_uri": "canon/NT/MAT.md#MAT.8:25",
  "text_tradition": "LXX",
  "generated_at": "2026-03-16T02:01:16+00:00",
  "generator_version": "phase3-backlinks-v1",
  "schema_version": "v2",
  "verse_text": "Then His disciples came to Him and awoke Him, saying, 'Lord, save us! We are perishing!'",
  "pericope": {
    "id": "MAT.P018",
    "title": "Unconditional Loyalty",
    "range": "MAT.8:17-8:26",
    "liturgical_use": []
  },
  "topic_threads": [],
  "depth_available": 3,
  "links": [
    {
      "source_file": "study/footnotes/OT/JOB_footnotes.md",
      "line_number": 554,
      "raw_match": "[[MAT.8:23]]-27",
      "reference_type": "wikilink_range",
      "context": ", 7 God uses the random winter storms and the rain and snow to show man his weakness in the face of God's overwhelming power. Indeed, Christ taught this lesson to His disciples when he calmed the storm ([[MAT.8:23]]-27). \"He has created man to be weak, and yet man thinks himself to be strong; and thereby he becomes even more feeble\" (JohnChr)."
    },
    {
      "source_file": "study/footnotes/OT/JON_footnotes.md",
      "line_number": 43,
      "raw_match": "[[MAT.8:24]]-26",
      "reference_type": "wikilink_range",
      "context": "Christ and His disciples had a very similar experience on a boat in a storm (see text and note at [[MAT.8:24]]-26)."
    }
  ]
}
