{
  "anchor_id": "1CO.14:14",
  "canon_uri": "canon/NT/1CO.md#1CO.14:14",
  "text_tradition": "LXX",
  "generated_at": "2026-03-16T02:01:16+00:00",
  "generator_version": "phase3-backlinks-v1",
  "schema_version": "v2",
  "verse_text": "For if I pray in a tongue, my spirit prays, but my understanding is unfruitful.",
  "pericope": {
    "id": "1CO.P030",
    "title": "Prophecy, Superior to Tongues",
    "range": "1CO.13:13-14:20",
    "liturgical_use": []
  },
  "topic_threads": [],
  "depth_available": 3,
  "links": [
    {
      "source_file": "study/footnotes/OT/EST_footnotes.md",
      "line_number": 48,
      "raw_match": "[[1CO.14:1]]-25",
      "reference_type": "wikilink_range",
      "context": "Note that the king's decree was distributed to all people according to their own language, so that all could understand and follow. This is why in the Orthodox Church throughout the world it is imperative that the gospel be preached ([[ACT.2:4]]-11) and the liturgy be celebrated ([[1CO.14:1]]-25) in the language spoken by the people (see also 3:12)."
    }
  ]
}
