{
  "anchor_id": "EZK.10:3",
  "canon_uri": "canon/OT/EZK.md#EZK.10:3",
  "text_tradition": "LXX",
  "generated_at": "2026-03-16T02:01:16+00:00",
  "generator_version": "phase3-backlinks-v1",
  "schema_version": "v2",
  "verse_text": "Now the cherubim were standing on the right side of the house as the man was entering, and the cloud filled the inner court.",
  "pericope": {
    "id": "EZK.P009",
    "title": "The Glory Leaves the Temple",
    "range": "EZK.9:11-10:20",
    "liturgical_use": []
  },
  "topic_threads": [],
  "depth_available": 3,
  "links": [
    {
      "source_file": "study/footnotes/NT/REV_footnotes.md",
      "line_number": 1324,
      "raw_match": "[[EZK.10:3]]",
      "reference_type": "wikilink",
      "context": "The temple was filled with smoke from the glory of God (see Is 6:4; [[EZK.10:3]], 4), so that no one was able to enter the temple (see [[EXO.40:29]], where Moses was unable to enter the tabernacle; and 3Kg 8:10, 11 where the priests were unable to enter the temple for the same reason). None may enter to intercede for the earth or to divert the coming catastrophe of God's sworn judgment."
    }
  ]
}
