{
  "anchor_id": "MAT.24:46",
  "canon_uri": "canon/NT/MAT.md#MAT.24:46",
  "text_tradition": "LXX",
  "generated_at": "2026-03-16T02:01:16+00:00",
  "generator_version": "phase3-backlinks-v1",
  "schema_version": "v2",
  "verse_text": "Blessed is that servant whom his master, when he comes, will find so doing.",
  "pericope": {
    "id": "MAT.P077",
    "title": "The Great Tribulation",
    "range": "MAT.24:14-24:47",
    "liturgical_use": []
  },
  "topic_threads": [],
  "depth_available": 3,
  "links": [
    {
      "source_file": "study/footnotes/NT/LUK_footnotes.md",
      "line_number": 1219,
      "raw_match": "[[MAT.24:45]]-51",
      "reference_type": "wikilink_range",
      "context": "See also [[MAT.24:45]]-51. The mark of a true disciple is vigilance in performing the work and exemplifying the virtue of the master."
    }
  ]
}
