{
  "anchor_id": "HAB.2:4",
  "canon_uri": "canon/OT/HAB.md#HAB.2:4",
  "text_tradition": "LXX",
  "generated_at": "2026-03-16T02:01:16+00:00",
  "generator_version": "phase3-backlinks-v1",
  "schema_version": "v2",
  "verse_text": "'If any man should shrink back, My soul will not be well pleased in him; but the righteous shall live by My faith.",
  "pericope": {
    "id": "HAB.P002",
    "title": "Habakkuk \u2014 Chapter 2",
    "range": "HAB.2:1-2:20",
    "liturgical_use": []
  },
  "topic_threads": [],
  "depth_available": 3,
  "links": [
    {
      "source_file": "study/footnotes/NT/ROM_footnotes.md",
      "line_number": 89,
      "raw_match": "[[HAB.2:4]]",
      "reference_type": "wikilink",
      "context": "The righteousness of God is to be in a continuous state of communion with Him. This state of being right with God originates with God and is accepted by mankind in faith. From faith to faith: We first receive Jesus Christ by faith and then live in Him by that faith. \"The just shall live by faith\" is one of the passages of the OT ([[HAB.2:4]]) most quoted in the NT. It shows the harmony between both testaments and summarizes the theme of Romans: faith is a way of life. The righteous (just means \"righteous\") are those who not only believe, but live righteously in accordance with their faith."
    }
  ]
}
