{
  "anchor_id": "MRK.13:4",
  "canon_uri": "canon/NT/MRK.md#MRK.13:4",
  "text_tradition": "LXX",
  "generated_at": "2026-03-16T02:01:16+00:00",
  "generator_version": "phase3-backlinks-v1",
  "schema_version": "v2",
  "verse_text": "'Tell us, when will these things be? And what will be the sign when all these things will be fulfilled?'",
  "pericope": {
    "id": "MRK.P045",
    "title": "The Beginning of Sorrows",
    "range": "MRK.13:2-13:22",
    "liturgical_use": []
  },
  "topic_threads": [],
  "depth_available": 3,
  "links": [
    {
      "source_file": "study/footnotes/NT/REV_footnotes.md",
      "line_number": 425,
      "raw_match": "[[MRK.13:4]]",
      "reference_type": "wikilink",
      "context": "To those faithful to Him, the Lord Jesus will in turn be faithful during the hour of trial that will come to the whole world by preserving them during that trial (see Jn 17:15) and protecting them from demonic assaults. Although the faithful will not be rescued from sufferings, persecution, and martyrdom, they will be sustained and supported so as to persevere in their faithfulness. The hour of trial is an apocalyptic image ([[DAN.12:1]]; [[MAT.6:13]]; [[MRK.13:4]]; [[JOH.17:6]], [[JOH.17:15]]; [[2TH.2:1]]-12), referring to the testing and tribulation (chs. 8; 9; 16) preceding the manifestation of the eternal Kingdom of God. Those who dwell on the earth is a commonly used term for the ungodly."
    }
  ]
}
